[
  {
    "id": "R_5FKyyCLziggLdgA",
    "slug": "fire-weather-testbed-evaluations-002-fire-detection",
    "title": "Fire Weather Testbed Evaluations #002: Fire Detection and Dissemination - NESDIS Next Generation Fire System and NWS Hotspot Notification Tool",
    "summary": "In June 2024, the NOAA Fire Weather Testbed conducted a five-day, in-person evaluation of the National Environmental Satellite, Data, and Information Service (NESDIS) Next Generation Fire System (NGFS) and NWS Hotspot Notification Tool…",
    "abstract": "In June 2024, the NOAA Fire Weather Testbed conducted a five-day, in-person evaluation of the National Environmental Satellite, Data, and Information Service (NESDIS) Next Generation Fire System (NGFS) and NWS Hotspot Notification Tool (HSNT). NGFS is a satellite-based AI algorithm utilizing NOAA’s geostationary and low Earth-orbiting satellites to detect and monitor wildland fires, highlighting potential new ignitions. It is developed jointly by NESDIS and the University of Wisconsin Space Science and Engineering Center’s Cooperative Institute for Meteorological Satellite Studies. HSNT, developed by NWS Norman, Oklahoma, disseminates fire detection locations and weather forecasts from NWS meteorologists to land management partners via text or email notifications. Four meteorologists and five state fire partners participated in the evaluation. After receiving NGFS and HSNT training, meteorologist–land manager pairs worked together on displaced real-time simulations. Participants completed daily surveys regarding NGFS usage during simulations and joined a final focus group to evaluate overall usability and utility. FWT facilitated two recorded focus group discussions—one for meteorologists and one for fire partners—allowing each group to focus on discipline-specific applications and feedback. The FWT analyzed their feedback to share with the product development team.",
    "authors": [
      {
        "name": "Emily Wells",
        "given": "Emily",
        "family": "Wells"
      },
      {
        "name": "Ansley Baring",
        "given": "Ansley",
        "family": "Baring"
      },
      {
        "name": "Benjamin Hatchett",
        "given": "Benjamin",
        "family": "Hatchett"
      },
      {
        "name": "Stephanie Hoekstra",
        "given": "Stephanie",
        "family": "Hoekstra"
      },
      {
        "name": "Laura Sample McMeeking"
      },
      {
        "name": "Kyle Thiem",
        "given": "Kyle",
        "family": "Thiem"
      },
      {
        "name": "Zach Tolby",
        "given": "Zach",
        "family": "Tolby"
      },
      {
        "name": "Jamie Vickery",
        "given": "Jamie",
        "family": "Vickery"
      }
    ],
    "org": "Cooperative Institute for Research in the Atmosphere",
    "completionYear": 2025,
    "firePhases": [
      "before",
      "during",
      "long-term"
    ],
    "projectType": "Testbed Evaluation",
    "methods": [
      "Survey",
      "Focus groups",
      "Workshop/roundtable discussions"
    ],
    "irbApproved": true,
    "geo": {
      "regions": [
        "ONCC",
        "OSCC",
        "RMCC",
        "SACC"
      ]
    },
    "takeaways": [
      "The publicly accessible NGFS provides utility as a fire detection and monitoring tool. It enhances situational awareness, serving as a safety net for forecasters. By incorporating NGFS detections, the HSNT adds capabilities for the NWS to alert partner agencies. The NGFS and HSNT should integrate effectively into NWS operational environments.",
      "By incorporating NGFS detections, the HSNT adds capabilities for the NWS to alert partner agencies. Evaluation findings suggested that the NGFS and HSNT can integrate effectively into NWS operational environments.",
      "The publicly available NGFS/HSNT notification tools were perceived as not resource intensive and therefore capable of filling needs, especially for resource-limited land management jurisdictions. Because it is publicly available, land management agencies could integrate NGFS into their own operational environments or GIS platforms.",
      "Participating meteorologists and land managers found that the NGFS’ high temporal resolution enhanced situational awareness for monitoring wildland fires (wildfire and prescribed)."
    ],
    "needs": [
      {
        "need": "Need for “safety net” tools among meteorologists: Automated \"safety net\" tools (like NGFS) are needed to monitor active fires and prevent missed detections, reducing cognitive overload during operations.",
        "recommendation": "Recommend ingesting NGFS into NWS Advanced Weather Interactive Processing System (AWIPS) with customizable display capabilities (e.g., hotspot detections overlaid with base satellite, meteorological, geographical data) and fire radiative power color-coding to help meteorologists differentiate new ignitions from known/older thermal activity."
      },
      {
        "need": "Need for adjustable alert thresholds among meteorologists: The capability for meteorologists’ to adjust and customize hotspot alert thresholds is needed to stay informed on emerging hotspots without becoming inundated during high-activity fire periods.",
        "recommendation": "Recommend integrating confidence/uncertainty flags and customizable local alert thresholds pre-determined with local land management partners."
      },
      {
        "need": "Need for contextual data and weather overlays among land managers: Land managers need contextual data, confidence indicators, and representative weather observations alongside hotspot detections to validate thermal anomalies and reduce concerns over false positive detections.",
        "recommendation": "Recommend training materials and documentation that explain the NGFS process (e.g., how it detects fires, integrates known wildland fire information, and incorporates uncertainty) to support land managers in validating detections with other sources."
      },
      {
        "need": "Need for controlled fire detection information flows among meteorologists and land managers: Both groups need information flows to notify land management partners about critical hotspot detections without overwhelming them with unnecessary data.",
        "recommendation": "Recommend adding a confirmation mechanism to “close the loop” between meteorologists and partner agencies to confirm receipt of NWS-provided hotspot notification(s)."
      },
      {
        "need": "Need for multi-modal communication options between meteorologists and land managers: Land managers need flexible, multi-modal communication options (including via text message) to ensure time-sensitive hotspot alerts reach field partners reliably despite internet connectivity constraints.",
        "recommendation": "Recommend ensuring multiple communication pathways are available for agency partners to use to send and receive NGFS/HSNT as needed."
      }
    ],
    "papers": [
      {
        "doi": "10.25923/4pqf-7g49",
        "title": "Fire Weather Testbed Evaluations #002–004: An End-to-End Evaluation of NOAA's Emerging Wildland Fire Detection and Warning Capabilities",
        "container": "NOAA technical memorandum OAR GSL ; 71",
        "year": 2025
      },
      {
        "url": "https://cimss.ssec.wisc.edu/ngfs/"
      }
    ],
    "published": true
  },
  {
    "id": "R_6LG6UbI2AXyQUtS",
    "slug": "igniting-insight-evaluating-nws-fire-weather-products",
    "title": "Igniting Insight: Evaluating NWS Fire Weather Products within a Fire Partner Decision Making Context",
    "summary": "This study evaluates how National Weather Service (NWS) partners (Fire Chiefs, Fire Analysts, Emergency Managers, etc.) utilize fire weather sources across the decision timeline—from long-range planning weeks in advance to tactical…",
    "abstract": "This study evaluates how National Weather Service (NWS) partners (Fire Chiefs, Fire Analysts, Emergency Managers, etc.) utilize fire weather sources across the decision timeline—from long-range planning weeks in advance to tactical response during active events—focusing mostly on Red Flag Warnings (RFWs) and Fire Warnings. Based on 19 focus groups with 85 participants across six NWS regions, RFWs are widely trusted throughout the planning timeline to build situational awareness, validate decisions, and justify resources, serving a supportive rather than initiating role. Conversely, tactical Fire Warnings face partner skepticism during rapid-onset events, with untrained partners citing fears of bureaucratic delays and jurisdictional friction. To improve utility across all decision phases, participants recommended RFW refinements—incorporating localized fuel data, cross-office consistency, and trend information—alongside a flexible framework for Fire Warnings.",
    "authors": [
      {
        "name": "Stephanie Hoekstra",
        "given": "Stephanie",
        "family": "Hoekstra"
      },
      {
        "name": "Benjamin Hatchett",
        "given": "Benjamin",
        "family": "Hatchett"
      },
      {
        "name": "Jamie Vickery",
        "given": "Jamie",
        "family": "Vickery"
      }
    ],
    "org": "Cooperative Institute for Research in the Atmosphere",
    "completionYear": 2025,
    "firePhases": [
      "before",
      "during"
    ],
    "projectType": "Research Study",
    "methods": [
      "Focus groups"
    ],
    "irbApproved": true,
    "geo": {
      "regions": [
        "NATIONAL"
      ]
    },
    "takeaways": [
      "Red Flag Warnings validate existing decisions, elevate situational awareness, and justify resources, but they serve a supportive rather than initiating role in operational fire management.",
      "Enhancing Red Flag Warning utility requires incorporating localized fuel data, increasing cross-office forecasting consistency, and delivering clear trend information to support complex decision timelines.",